Source,Title,Date,URL,Content
CNAS,Semiconductor Imports and U.S. National Security,"May 27, 2025",https://www.cnas.org/publications/commentary/semiconductor-imports-and-u-s-national-security,"The Secretary of Commerce has initiated aSection 232investigation to determine the effects on the national security of imports of semiconductors and semiconductor manufacturing equipment, and their derivative products. In this submission, we analyze how these imports impact U.S. national security and provide four recommendations for the Department's consideration.

Semiconductor imports implicate U.S. national security in multiple ways. Integration with foreign markets can strengthen U.S. national security in the semiconductor sector: foreign imports provide access to semiconductors at competitive prices, enabling more efficient spending on defense industrial base priorities. However, reliance on imports in the semiconductor industry can create vulnerabilities for U.S. national security, particularly from the People’s Republic of China’s (PRC) growing role in the global semiconductor supply chain.

Given the complex set of national security interests at stake, the United States needs a comprehensive national strategy for strengthening capabilities in the semiconductor sector to address national security risks arising from the PRC’s growing role in the global supply chain. We recommend the Department adopt a broad examination of potential remedies.

Recommendation: Negotiate a sectoral agreement on semiconductor supply chains to promote trade and economic security with like-minded partners

The administration should explore negotiating a sectoral trade and economic security agreement with partners and allies that share U.S. concerns associated with the PRC’s influence on the global semiconductor supply chain. By creating an integrated market of trusted suppliers, the United States and its partners can build a market large enough to maintain competition and investment in R&D while negating the national security risks posed by the PRC and other foreign adversaries. Such an agreement should include measures to deepen market integration among participants as well as alignment on common trade protection, export control, investment security, and related defensive measures.

Recommendation: Invest in and properly resource tools to enhance supply chain visibility

To better identify and proactively alleviate national security risks associated with semiconductor imports, the U.S. government needs deeper visibility into semiconductor supply chains. Without better supply chain visibility for both industry and government, firms will be vulnerable to unforeseen shocks and policies risk imprecision and unintended consequences. Given the complexity and dynamic nature of these networks, the government should seek to advance public-private cooperation to improve supply chain visibility.

Recommendation: Align any trade protection measures on semiconductors with the U.S. strategy for AI dominance

The administration has identified advancing U.S. AI dominance as a key national goal. Semiconductor policy should align with these objectives, given the fundamental role that computing power driven by semiconductors plays in advancing the AI frontier. Raising U.S. semiconductor costs in the near term—even in service of longer-term rebalancing—would carry significant strategic risk. It could slow the pace of domestic compute buildout at a critical moment, making the United States a less attractive location for training and deploying hyperscale AI systems and eroding associated U.S. leverage to shape global AI norms and prevent exploitation of compute-intensive AI capabilities by adversaries.

Recommendation: Minimize any negative spillovers on the U.S. defense industrial base

The U.S. defense industrial base is dependent on commercial off-the-shelf components in the semiconductor sector, including for both leading-edge and legacy chips as well as derivative downstream products. Given pre-existing stresses on the U.S. defense industrial base, any near term cost increases and supply chain shocks to semiconductors could introduce significant vulnerabilities to U.S. warfighting capabilities. In the course of the Section 232 investigation, as part of the Department’s consultation with the DoD as mandated by statute, the U.S. government should thoroughly assess both immediate and longer term impacts of trade protection measures on the U.S. defense industrial base."
CNAS,Countering AI Chip Smuggling Has Become a National Security Priority,"June 11, 2025",https://www.cnas.org/publications/reports/countering-ai-chip-smuggling-has-become-a-national-security-priority,"Based on the available evidence, artificial intelligence (AI) chip smuggling has likely been occurring at a scale that significantly undermines U.S. attempts to restrict the People’s Republic of China’s (PRC’s) access to advanced AI. This is indicated by four lines of argument:

Smuggling should be expected based on historical precedent. The PRC has a long history of smuggling U.S. technology despite export restrictions, which has rarely resulted in criminal or civil penalties.1

Smuggling of U.S. AI chips is highly incentivized by their superior performance, higher supply, and more mature software ecosystem relative to chips legally available to Chinese AI labs.2Based on publicly available data, of the 22 notable models that had been developed exclusively in the PRC by 2025, only two were trained with Chinese chips.3

Six news outlets have independently reported evidence of large-scale AI chip smuggling, totaling tens to hundreds of thousands of chips smuggled in 2024. One smuggler reportedly handled an order of for servers containing 2,400 NVIDIA H100s—worth $120 million—to a customer in the PRC.4Another facilitated an order worth $103 million.5Singapore authorities arrested three individuals suspected of diverting AI servers worth $390 million.6Within this reporting, multiple chip resellers and start-ups in the PRC have claimed that gaining access to export-controlled AI chips is straightforward, with one Chinese start-up founder estimating in 2024 that there were more than 100,000 NVIDIA H100s in the PRC.7Most of the Chinese chip sellers interviewed in these reports confirm that they work with multiple distributors, use shell companies based overseas, and employ simple tactics to avoid detection, such as relabeling shipments as tea or toys.8

There are many online listings for export-controlled AI chips available for purchase in the PRC.The authors conducted a non-exhaustive search of three Chinese online marketplaces and found 132 domestic listings for export-controlled chips, along with many photos of supposedly smuggled goods.9Where sellers provided information on stock, the average quantity of export-controlled graphics processing units (GPUs) per listing was around 1,200 for GPU server listings and 400 for GPU card listings. Though this data is patchy and likely unreliable, the total stock implied is around 100,000 H100 GPUs, as of December 2024.

Across these data sources, there is much uncertainty in either direction. Using publicly available data from this reporting, while accounting for uncertainty about its veracity, the authors estimate the total scale of AI chip smuggling to the PRC in 2024 could have ranged anywhere from 10,000 to several hundred thousand chips, with a median estimate of around 140,000. This estimate is based on a probabilistic model of chip smuggling as an extrapolation of known cases. It should be understood as a high-level distribution of possible outcomes, rather than a summation of confirmed smuggling cases.10

If the true number is close to the median of this distribution,smuggled chips would make up a significant portion of AI compute acquired by the PRC in 2024—between 1 and 30 percent of its inference compute capacity (median 6 percent) or between 1 and 40 percent of its training compute capacity (median 10 percent).Other sources of PRC AI compute acquisition considered are Huawei Ascend chips fabricated by China’s Semiconductor Manufacturing International Corporation (SMIC) and Taiwan Semiconductor Manufacturing Company (TSMC), and NVIDIA H20 chips legally exported into the PRC. Because the export of the H20 was restricted in April 2025, and TSMC is under investigation for its role in fabricating chips for Huawei, smuggled chips may make up a much larger portion of AI compute acquired by the PRC in 2025 and beyond.11

Given the potential scale of AI chip smuggling to the PRC, policymakers should prioritize gathering information to better understand its true extent. Large-scale chip smuggling and uncertainty about its true extent exist partly because the Bureau of Industry and Security (BIS)—the part of government tasked with administering and enforcing AI chip export controls—is under-resourced. The BIS’s budget for enforcement has decreased in real terms over time, even after it was tasked with far more responsibilities in 2022 following Russia’s invasion of Ukraine and the introduction of a wide range of new export controls on AI chips and related tooling. The profits likely netted by chip smugglers from just three reported smuggling cases fromThe New York TimesandThe Informationare more than double the BIS’s annual budget for export control enforcement.12

AI chip smuggling is a recent problem, and counterefforts remain limited. Moreover, AI chip companies typically lack the deep experience in exporting sensitive goods that exists, for example, in the defense industry. As a result, there are many promising steps that government and industry could take to solve this problem. The authors offer six recommendations:

AI chip companies and their distributors should leverage their technical capacities and resources to significantly strengthen theirdue diligence processes,make similar requirements of any distribution firms to which they sell, and report to the BIS on specific measures taken.

The BIS could use its existing authorities tocreate a new notification requirement for controlled AI chip exports, reexports, and ownership transfers.This would enable much better tracking of controlled chips exported outside the United States, allowing for more efficient enforcement.

AI chip designers should implement software-basedlocation verificationfeatures, allowing the owner of a controlled chip to prove that the chip is not located in the PRC. This would both provide valuable data on the scale of chip smuggling and provide a useful mechanism for enforcement, enabling knowledge of which specific devices have been smuggled, and knowledge of which exporters and downstream entities were responsible. BIS could incentivize the development of these features through the normal export licensing process today, by requiring chip owners outside the United States to periodically prove that their chips are not in the PRC as a condition for importing chips.

The Department of Commerce, incoordination with the intelligence community (IC), could establish processes to generate information on the scale, locations, and perpetrators of AI chip smuggling, and share it with the BIS to aid enforcement, inform policy, and share leads with relevant industry actors. This could be facilitated through the Director for National intelligence (DNI) updating the National Intelligence Priorities Framework to make intelligence collection related to export control enforcement a top priority, and the DNI and Secretary of Commerce establishing a joint analysis team (for example, in the Export Control Enforcement Center) to facilitate BIS-IC coordination.

Congress could authorize awhistleblower incentive programand qui tam lawsuits(lawsuits that allow a private person to prosecute on behalf of the government) to incentivize reports of possible export violations. These two measures could significantly boost the BIS’s export enforcement while paying for themselves in revenue generated through additional penalties. A whistleblower program could be modeled on the highly successful Securities and Exchange Commission (SEC) Whistleblower Program, which tackles federal securities laws violations and has aided the collection of $7 billion to $22 billion in penalties since 2011.13In April 2025, a bipartisan bill was introduced in the Senate to implement such a program.14Authorizing qui tam lawsuits against those who violate the export rules would additionally allow individuals to sue a violator and collect a portion of the resulting penalty, modeled on a similar law in the False Claims Act.

Finally, Congress could grantthe White House’s requested budget of $313 million for the BISfor fiscal year 2026. This 64 percent increase over the BIS’s current budget of $191 million would help the BIS modernize its tooling and improve operational capacity. In addition to strengthening national security, funding to improve the enforcement of the AI chip controls would likely pay for itself through increased collection of fines on violators of the export rules. The multiple documented instances of AI chip smuggling from 2024 alone could each have resulted in penalties of over $200 million, more than the BIS’s annual budget.

As controlling access to advanced AI capabilities becomes an increasing national security imperative, U.S. policymakers should prioritize actions to collect more reliable information on the extent of AI chip smuggling and close gaps wherever possible."
CNAS,Rising to the China Challenge,"January 28, 2020",https://www.cnas.org/publications/reports/rising-to-the-china-challenge,An independent assessment for Congress as mandated by the FY2019 National Defense Authorization Act.
CNAS,Sanctions by the Numbers: 2024 Year in Review,"March 11, 2025",https://www.cnas.org/publications/reports/sanctions-by-the-numbers-2024-year-in-review,"Executive Summary
In 2024, the United States issued an unprecedented number of financial sanctions and entity-based export controls. Washington’s economic statecraft has expanded in recent years, largely in response to Russia’s war in Ukraine, competition with the People’s Republic of China, and tensions in the Middle East. These geopolitical developments, along with escalating concerns about deepening ties among U.S. adversaries, shaped how the United States deployed its coercive economic toolkit last year. This installment of Sanctions by the Numbers examines the United States’ use of financial sanctions—through the Treasury Department’s Specially Designated Nationals and Blocked Persons (SDN) List—and entity-based export controls—via the Commerce Department’s Entity List—in 2024.
The Treasury Department added 3,135 persons (i.e., individuals or entities) to the SDN List in 2024. This is a 25 percent increase from 2023, when 2,502 persons were designated.
The Commerce Department placed 520 persons on the Entity List in 2024, an 11 percent increase from 2023, when 468 persons were added.
Russia was the primary target of U.S. financial sanctions, with 1,706 Russian persons placed on the SDN List. Russia was also the second-largest recipient of entity-based export controls, with 147 Russian persons added to the Entity List.
China received the second-highest number of financial sanctions and the most entity-based export controls, with 276 Chinese persons placed on the SDN List and 263 Chinese persons added to the Entity List.
The analysis is based on the authors’ review of U.S. government data on SDN designations and Entity List additions, including press releases and Federal Register Notices that accompany such designations and additions. The data used in this report can be found
here
. This report covers SDN designations and Entity List additions for calendar year 2024. Where appropriate, certain news developments past this period are noted in the analysis, but no sanctions after December 31, 2024, are reflected in the numbers."
CNAS,How the U.S. Can Counter China's Digital Silk Road in Saudi Arabia,"September 16, 2025",https://www.cnas.org/press/press-release/how-the-u-s-can-counter-chinas-digital-silk-road-in-saudi-arabia,"Washington, September 16, 2025 – Today, the Center for a New American Security (CNAS) released a new report,
Countering the Digital Silk Road: Saudi Arabia
by
Vivek Chilukuri
and
Ruby Scanlon
.
The Digital Silk Road (DSR) is China’s initiative to shape critical digital infrastructure around the world. As the DSR marks its 10th anniversary, the CNAS Technology and National Security Program has undertaken a major research project to assess its impact and explore how the United States and its allies can offer a more compelling and coherent alternative. The project includes four case studies of strategically critical nations—
Indonesia
,
Brazil
,
Kenya
, and Saudi Arabia—and will culminate in an in-depth final report in October.
The series’ fourth and final case study covers the Kingdom of Saudi Arabia. Through Vision 2030, Saudi Arabia seeks to transition from its longtime petro-economy into a global tech powerhouse. Up to 70 percent of Vision 2030’s goals relate to data and artificial intelligence (AI), but the kingdom will need foreign partners to realize them. Recognizing the opportunity, both the United States and China now compete fiercely to become the kingdom’s preferred partner as it undergoes this historic, technology-driven transformation.
The new case study traces the history of U.S.-Saudi and Sino-Saudi technology partnerships and details the rapidly expanding U.S.-China competition within the kingdom with a focus on data centers, semiconductors, and AI. The report also provides an in-depth look at new Saudi state-backed investment arms, initiatives, and policies driving the country’s technology transformation.
The report concludes that, although Riyadh will resist demands for outright alignment with the U.S. technology ecosystem given its maturing relationship with Beijing, considerable opportunity remains for U.S. officials and industry to outcompete China’s DSR in the heart of Arabia while protecting sensitive U.S. technologies. The report recommends that policymakers:
Conclude a secure, phased, and verifiable deal with Saudi Arabia for advanced AI chips.
Support the expansion of Saudi fabrication capacity for legacy chips while limiting support for leading-edge semiconductor design tools and research.
Establish a process to fast-track inbound investments from allied and partner sources for U.S. strategic technologies.
Leverage people-to-people ties to support Riyadh’s Saudization policies.
Engage the Saudi Communications, Space, and Technology Commission about the draft Global AI Hub Law.
Pilot a joint effort by the U.S. Department of Homeland Security, the Department of State, and the Department of Energy to bolster AI data center security in strategic overseas markets, like Saudi Arabia.
Support eventual Saudi transition to 6G through research partnerships.
The full report can be read here. CNAS will release an in-depth final report on countering the Digital Silk Road in October.
For more information or to arrange an interview with the report’s authors, please contact
Charles Horn at
[email protected]
."
CNAS,"America Should Rent, Not Sell, AI Chips to China","August 15, 2025",https://www.cnas.org/publications/commentary/america-should-rent-not-sell-ai-chips-to-china,"This article was originally published onRAND.President Trump announced Monday that Nvidia will pay the U.S. government 15 percent of the revenue it derives from sales of its H20 chip to China—an unusual arrangement that gives up leverage. The United States could do better: Rather than selling AI chips, the United States should instead rent them to China to permanently maintain its AI chip edge.Controversy surrounding NVIDIA's China-specific H20 AI chip has reignited debate over chip exports to China. Proponents of H20 exports argue that sales keep China dependent on U.S. technology while generating revenue. They claim denying access would only accelerate China's drive for homegrown alternatives. These arguments miss a superior alternative to selling chips that would yield similar benefits to the United States: providing China with the computing power it seeks for a fee via remote cloud access

Selling AI chips to China outright reduces America's AI lead for little benefit.

Selling AI chips to China outright reduces America's AI lead for little benefit.

When the United States sells chips, they're gone forever—disappearing into data centers with unknown users pursuing unknown goals. There's another option: give users the computing power of chips remotely. Cloud services offer almost everything chip sales promise, plus actual control: access can be shut off at any stage (PDF) as geopolitical conditions change or threats arise. The economics are better too. AI chips are sold to U.S. cloud providers, who generate additional revenue by renting AI chips to China—creating two revenue streams instead of one. Companies like Amazon and Microsoft already serve global customers this way, maintaining physical possession of the chips while providing computational power on demand.Unlike physical chip exports, cloud access makes it significantly harder for customers to redirect access to unauthorized parties. Know-your-customer requirements enable monitoring for connections to Chinese military entities. Cloud access also creates continuous leverage—every renewal becomes a negotiation opportunity, compared to chips that get replaced only every three to four years.Read the full article onRAND."
CNAS,Rethinking the Global AI Race,"July 21, 2025",https://www.cnas.org/publications/commentary/rethinking-the-global-ai-race,"This article was originally published onJust Security.The global competition over artificial intelligence is increasingly framed in stark and dramatic terms, often compared to the Manhattan Project, a new arms race, or a moonshot project requiring incredible resources to attain a difficult, if not, impossible goal. These analogies all suffer from a common flaw: they point us toward the wrong goal. AI is not a discrete project with a clear endpoint, like building a nuclear weapon or landing on the moon. It is a long-term, society-wide effort to develop powerful tools and ensure their benefits reach classrooms, battlefields, factories, and start-ups alike.

The country that leverages advances in AI to establish and maintain substantial economic and military advantages will not necessarily be the one that develops the most advanced models in the shortest amount of time. The United States is not going to win the AI race against China, for example, simply because U.S.-made OpenAI models beat Chinese-made DeepSeek or Kimi K2 models on capability benchmarks. Instead, countries that learn how to bridge the gap between invention and widespread societal adoption will reap the most crucial benefits in the long term.

The United States must stop running as if this were only a 100-meter dash and start acting like a strategic marathoner: moving with urgency, clarity, and sustained commitment.

The United States must stop running as if this were only a 100-meter dash and start acting like a strategic marathoner: moving with urgency, clarity, and sustained commitment.

By taking a longer view, the United States can make smarter decisions about how to align technological progress with national security and public welfare. If it continues to frame AI primarily as a short-term sprint toward technical milestones, it risks falling behind global peers and adversaries.Gaining and maintaining a long-term competitive advantage in AI will require more than technical superiority. It demands reorienting education and workforce training, modernizing institutions, and setting a national vision based on broad public engagement. By adopting this strategy, the United States can accomplish what other countries may struggle to replicate: a whole-of-society approach to AI.

Read the full article onJust Security."
